{
    "specVersion": "0",
    "description": "A table in a schema that lacks its description file.",
    "tableType": "hive_parquet",
    "isRawData": true,
    "columns": [
        {
            "name": "id",
            "type": "bigint",
            "description": "Identifier."
        }
    ],
    "primaryKey": [
        "id"
    ]
}
